201229;Терминал распознавания лица Dahua DHI-ASI6213S-PW;Термінал розпізнавання обличчя Dahua DHI-ASI6213S-PW;DHI-ASI6213S-PW, Dahua DHI-ASI6213S-PW, система доступа по картам, электронная система доступа, биометрический контроль доступа, скуд для офиса, система контроля и управления доступом, система контроля доступа, скуд, контроллер доступа, считыватель карт доступа;DHI-ASI6213S-PW, Dahua DHI-ASI6213S-PW, система доступу по картах, електронна система доступу, біометричний контроль доступу, скд для офісу, система контролю та управління доступом, система контролю доступу, скд, контролер доступу, зчитувач карт доступу;Дисплей 4.3 дюймов, сенсорный,<br/>Двойная камера 2МП,<br/>Разблокировка по распознаванию лица и по карте доступа, паролю, QR коду,<br/>Карты доступа Mifare,<br/>6000 лиц\ 10 000 карт доступа\ 300 000 событий,<br/>Антипассбек, тайм-аут датчика двери, карты, обнаружение лицевой маски и обнаружения защитного шлема, управление посещаемостью и экспорт записей посещаемости,<br/>Wiegand, RS485,<br/>Класс защиты IP65;Дисплей 4.3 дюйми, сенсорний,<br/>Подвійна камера 2МП,<br/>Розблокування за розпізнаванням обличчя та картою доступу, паролем, QR кодом,<br/>Картки доступу Mifare,<br/>6000 облич\ 10 000 карт доступу\ 300 000 подій,<br/>Антипасбек, тайм-аут датчика дверей, картки, виявлення лицьової маски та виявлення захисного шолома, управління відвідуваністю та експорт записів відвідуваності,<br/>Wiegand, RS485,<br/>Клас захисту IP65;r;246,96;USD;шт.;;;;https://images.prom.ua/4997031178_terminal-raspoznavaniya-litsa.jpg;+;6;127628166;Терминалы;https://prom.ua/Sistemy-kontrolya-dostupa;;;;;2863456012;99-00013764;3030;;Dahua Technology;;;;VMAX, V;https://oniks.org.ua/p2863456012-terminal-raspoznavaniya-litsa.html;;;-;Ще краща  ціна за 📞;;;;;;;0.840;;;;;Метод роботи;;Картка, пульт, пароль, QR-код, обличчя та кодове розблокування;Камера;;2 МП;Пам'ять карт і подій;;10 000\ 300 000;Пам'ять облич;;6 000;Тип карт;;Mifare;Wi-Fi;;2.4 ГГц IEEE802.11b/802.11g/802.11n;Інтерфейси введення;;1×RS-485, 1 × Wiegand, тривога, кнопка виходу, статус дверей;Інтерфейси виходу;;тривога, контроль замку;Дисплей;;4.3″ LCD, 272 (Г) × 480 (В);Живлення;;Мережа 12В;Робоча температура;;–30 °C - +60 °;Ступінь захисту;;IP65;Антісаботаж;;Підтримує;Розміри;;180 × 90 × 27 мм;Вага;;700;Монтаж;;накладний;Кількість в ящику;;8 шт;Розмір упаковки (Ш х В х Г);;240 x 75 x 270 мм;Вага брутто;;840;Строк гарантії;;24 міс.;Кількість шаблонів особи;;6 000;Підтримка стандартів;;Mifare;Протокол зв'язку;;Wiegand;Інтеграція з системами і ПО;;Так;Монітор;;LCD;Індикація;;Світлова/Звукова;Датчик злому;;Так;Гарантійний термін (міс);;24;;;;;;;;;;;;;;;;;;;;;;;;;;;;;;;;;;;;;;;;;;;;;;;;;;;;;;;;;;;;;;;;;;;;;;;;;;;;;;;;;;;;;;;;;;;;;;;;;;;;;;;;;;;;;;;;;;;;;;;;;;;;;;;;;;;;;;;;;;;;;;;;;;;;;;;;;;;;;;;;;;;;;;;;;;;;;;;;;;;;;;;;;;;;;;;;;;;;;;;;;;;;;;;;;;;;;;;;;;;;;;;;;;;;;;;;;;;;;;;;;;;;;;;;;;;;;;;;;;;;;;;;;;;;;;;;;;;;;;;;;;;;;;;;;;;;;;;;;;;;;;;;;;;;;;;;;;;;;;;;;;;;;;;;;;;;;;;;;;;;;;;;;;;;;;;;;;;;;;;;;;;;;;;;;;;;;;;;;;;;;;;;;;;;;;;;;;;;
201365;Контроллер для одной двери Seven CR-772m (EM) со считывателем;Контролер для однієї двері Seven CR-772m (EM) зі зчитувачем;CR-772m, контроллер на одну дверь, контроллер z5r, ip контроллер доступа, контроллер управления доступом, контроллер доступа, контроллер скуд, сетевой контроллер доступа, автономный контроллер;CR-772m, контролер на двоє дверей, контролер z5r, ip контролер доступу, контролер управління доступом, контролер доступу, контролер скд, мережевий контролер доступу, автономний контролер;Количество точек прохода 1,<br/>Интерфейс проводной,<br/>Протокол связи Wiegand,<br/>Поддержка стандартов EM Marine,<br/>Количество шаблонов карт/ключей 2000,<br/>Индикация световая/звуковая,<br/>Защита IP66;Кількість точок проходу 1,<br/>Інтерфейс дротовий,<br/>Протокол зв'язку Wiegand,<br/>Підтримка стандартів EM Marine,<br/>Кількість шаблонів карт/ключів 2000,<br/>Індикація світлова/звукова,<br/>Захист IP66;r;26,41;USD;шт.;;;;https://images.prom.ua/4777658327_kontroller-dlya-odnoj.jpg, https://images.prom.ua/6992238784_kontroller-dlya-odnoj.jpg, https://images.prom.ua/6992238787_kontroller-dlya-odnoj.jpg;-;0;127628176;Контроллеры;https://prom.ua/Kontrollery;;;;;2863456146;99-00005885;301312;;Seven;;;;Vmin, V;https://oniks.org.ua/p2863456146-kontroller-dlya-odnoj.html;;;-;Ще краща  ціна за 📞;;;;;;;0.150;;;;;Розмір упаковки (Ш х В х Г);;103 x 20 x 48 мм;Вага брутто;;150;Розміри;;103 х 48 х 20 мм;Строк гарантії;;12 міс.;Рабочая температура;;до -40 ℃;Питание;;12В;Класс защиты;;IP66;Інтерфейс зв'язку;;Wiegand;Пам'ять;;2000 карт;Количество дверей;;1;Формат вбудованого зчитувача;;EM Marine;;;;;;;;;;;;;;;;;;;;;;;;;;;;;;;;;;;;;;;;;;;;;;;;;;;;;;;;;;;;;;;;;;;;;;;;;;;;;;;;;;;;;;;;;;;;;;;;;;;;;;;;;;;;;;;;;;;;;;;;;;;;;;;;;;;;;;;;;;;;;;;;;;;;;;;;;;;;;;;;;;;;;;;;;;;;;;;;;;;;;;;;;;;;;;;;;;;;;;;;;;;;;;;;;;;;;;;;;;;;;;;;;;;;;;;;;;;;;;;;;;;;;;;;;;;;;;;;;;;;;;;;;;;;;;;;;;;;;;;;;;;;;;;;;;;;;;;;;;;;;;;;;;;;;;;;;;;;;;;;;;;;;;;;;;;;;;;;;;;;;;;;;;;;;;;;;;;;;;;;;;;;;;;;;;;;;;;;;;;;;;;;;;;;;;;;;;;;;;;;;;;;;;;;;;;;;;;;;;;;;;;;;;;;;;;;;;;;;;;;;;;;;;;
201734;Блок питания Full Energy BGM-123U 12 В / 3 А;Блок живлення Full Energy BGM-123U 12 В / 3 А;BGM-123U, блок питания din рейка, блок питания 24в, блок питания для светодиодной ленты, блок питания mean well, блок питания для камеры, блок питания, импульсный блок питания, блок питания 12в, промышленный блок питания;BGM-123U, блок живлення din рейка, блок живлення 24в, блок живлення для світлодіодної стрічки, блок живлення mean well, блок живлення для камери, блок живлення, імпульсний блок живлення, блок живлення 12в, промисловий блок живлення;● выходная мощность: 36 Вт,<br/>● выходное напряжение: 12 В,<br/>● номинальный выходной ток: 3 А,<br/>● шум и пульсации: 120 мВ,<br/>● входное напряжение: AC 100-240 В,<br/>● входящий ток: 1 A,<br/>● КПД: 80%;● вихідна потужність: 36 Вт,<br/>● вихідна напруга: 12 В,<br/>● номінальний вихідний струм: 3 А,<br/>● шум та пульсації: 120 мВ,<br/>● вхідна напруга: AC 100-240 В,<br/>● вхідний струм: 1 A,<br/>● ККД: 80%;r;9,89;USD;шт.;;;;https://images.prom.ua/6931938230_blok-pitaniya-full.jpg, https://images.prom.ua/6992261432_blok-pitaniya-full.jpg;+;4;127351950;Блоки питания;https://prom.ua/Promyshlennye-istochniki-pitaniya;;;;;2863456542;99-10027682;14191103;;Full Energy;;;;Vmin, V;https://oniks.org.ua/p2863456542-blok-pitaniya-full.html;;;-;Ще краща  ціна за 📞;;;;;;;0.070;11.0;7.8;3.6;;Потужність;;36 Вт;Вхідна напруга;;AC 100-240 В;Вихідна напруга;В;12;Сила струму на виході;;3 А;Особливості;;шум та пульсації: 120 мВ;Розміри;;110 х 78 х 36 мм;Розмір упаковки (Ш х В х Г);;50 x 85 x 120 мм;Вага брутто;;70;Вихідна потужність;Вт;36;Мінімальна вхідна напруга;В;100;Максимальна вхідна напруга;В;240;Вихідний струм, не більше;А;3;Ширина;мм;110;Висота;мм;78;Довжина;мм;36;Вага;г;70;;;;;;;;;;;;;;;;;;;;;;;;;;;;;;;;;;;;;;;;;;;;;;;;;;;;;;;;;;;;;;;;;;;;;;;;;;;;;;;;;;;;;;;;;;;;;;;;;;;;;;;;;;;;;;;;;;;;;;;;;;;;;;;;;;;;;;;;;;;;;;;;;;;;;;;;;;;;;;;;;;;;;;;;;;;;;;;;;;;;;;;;;;;;;;;;;;;;;;;;;;;;;;;;;;;;;;;;;;;;;;;;;;;;;;;;;;;;;;;;;;;;;;;;;;;;;;;;;;;;;;;;;;;;;;;;;;;;;;;;;;;;;;;;;;;;;;;;;;;;;;;;;;;;;;;;;;;;;;;;;;;;;;;;;;;;;;;;;;;;;;;;;;;;;;;;;;;;;;;;;;;;;;;;;;;;;;;;;;;;;;;;;;;;;;;;;;;;;;;;;;;;;;;;;;;;;;;;;;;;;;;;;;;;;;;;
201811;Инвертор MUST PV18-5548 ECO 5500VA/5500W 48V однофазный чистая синусоида;Інвертор MUST PV18-5548 ECO 5500VA/5500W 48V однофазний чиста синусоїда;инвертор 2000w, автомобильный инвертор, инвертор 3000w, солнечный инвертор, инвертор с зарядным устройством, инвертор 1000w, инвертор, преобразователь напряжения, инвертор 12 220, инвертор чистый синус;інвертор 2000w, автомобільний інвертор, інвертор 3000w, сонячний інвертор, інвертор з зарядним пристроєм, інвертор 1000w, інвертор, перетворювач напруги, інвертор 12 220, інвертор чистий синус;● Форма сигнала чистая синусоида,<br/>● Номинальная мощность,Вт 5500,<br/>● Пиковая мощность,Вт(в течении 5 сек) 11000,<br/>● Характеристики зарядно-разрядного устройства : Номинальное напряжение,В 48, Максимальный ток заряда,А (сеть + солнце) 100, Максимальный ток заряда от сети,А 100, Максимальный ток разряда солнце,А 28, тип батарей GEL/AGM/LEAD/Li ,<br/>● Количество МРРТ 1,<br/>● Номинальная мощность МРРТ ,Вт 6000,<br/>● Интерфейс RS232/CAN,<br/>● 318 х 454 х 122.5 мм,<br/>● 9 кг;● Форма сигналу чиста синусоїда,<br/>● Номінальна потужність, Вт 5500,<br/>● Пікова потужність, Вт (протягом 5 сек) 11000,<br/>● Характеристики зарядно-розрядного пристрою : Номінальна напруга,В 48, Максимальний струм заряду,А (мережа + сонце) 100, Максимальний струм заряду від мережі,А 100, Максимальний струм розряду сонце,А 28, тип батарей GEL/AGM/LEAD/ Li,<br/>● Кількість МРРТ 1,<br/>● Номінальна потужність МРРТ, Вт 6000,<br/>● Інтерфейс RS232/CAN,<br/>● 318 х 454 х 122.5 мм,<br/>● 9 кг;r;541,84;USD;шт.;;;;https://images.prom.ua/6705653579_invertor-must-pv18-5548.jpg, https://images.prom.ua/6992264211_invertor-must-pv18-5548.jpg;-;0;144038804;Инверторы;https://prom.ua/Invertory;;;;;2863948925;99-10029537;5140401;;Must;;;;Vmin, V;https://oniks.org.ua/p2863948925-invertor-must-pv18.html;;;-;Ще краща  ціна за 📞;;;;;;;10.320;31.8;45.4;12.2;;Розмір упаковки (Ш х В х Г);;410 x 210 x 550 мм;Вага брутто;;10320;Рабочая температура;;0°C- +50°C;Довжина;мм;122,5;Ширина;мм;318;Висота;мм;454;Вес;г;9000;Інтерфейс зв'язку;;RS485,CAN;Минимальная рабочая температура;град.;0;Розміри, мм;;318 х 454 х 122.5 мм;Максимальная рабочая температура;град.;50;Номинальная мощность;;5 500;Вихідна потужність, Вт;;5 500;Форма вихідної напруги;;Чиста синусоїда;Кількість фаз живлення;;1;Напруга батареї, В;;48;Струм зарядки батареї, А;;100;Номінальний струм;А;100;Напруга сонячних панелей, В;;60-360;Струм сонячних панелей, А;;28;Кількість MPPT(PWM)/стрінг на трекер;;1;Потужність сонячних панелей, Вт;;6000;Максимальна потужність;Вт;6000;Номинальное входное напряжение;В;48;;;;;;;;;;;;;;;;;;;;;;;;;;;;;;;;;;;;;;;;;;;;;;;;;;;;;;;;;;;;;;;;;;;;;;;;;;;;;;;;;;;;;;;;;;;;;;;;;;;;;;;;;;;;;;;;;;;;;;;;;;;;;;;;;;;;;;;;;;;;;;;;;;;;;;;;;;;;;;;;;;;;;;;;;;;;;;;;;;;;;;;;;;;;;;;;;;;;;;;;;;;;;;;;;;;;;;;;;;;;;;;;;;;;;;;;;;;;;;;;;;;;;;;;;;;;;;;;;;;;;;;;;;;;;;;;;;;;;;;;;;;;;;;;;;;;;;;;;;;;;;;;;;;;;;;;;;;;;;;;;;;;;;;;;;;;;;;;;;;;;;;;;;;;;;;;;;;;;;;;;;;;;;;;;;;;;;;;;;;;;;;;;;;;;;;;;;;;;;;;;;;;;;;;
201652;Бесперебойный блок питания Faraday Electronics UPS ASCH PL 14В 3А;Безперебійний блок живлення Faraday Electronics UPS ASCH PL 14В 3А;ибп для компьютера, ибп онлайн, ибп для котла, ибп для видеонаблюдения, источник бесперебойного питания 12в, резервное питание, ибп 1000va, ибп, источник бесперебойного питания, ups, бесперебойник;дбж для комп'ютера, дбж онлайн, дбж для котла, дбж для відеоспостереження, джерело безперебійного живлення 12в, резервне живлення, дбж 1000va, джерело безперебійного живлення, дбж, ups, безперебійник;● номинальная выходная мощность: 55Вт,<br/>● выходное напряжение (от сети): 14.1В,<br/>● выходное напряжение (от АКБ): 10.5-13.8В,<br/>● напряжение заряда АКБ: 13.8В,<br/>● напряжение отключения АКБ: 10.4-10.6В,<br/>● ток отключения АКБ (без сети): 4.5А,<br/>● выходной ток на нагрузку: 3А,<br/>● ток заряда АКБ: 0.7А,<br/>● рекомендуемая ёмкость АКБ: 9-12Ач,<br/>● ток поддержки заряженного АКБ: 20-100мА в зависимости от типа АКБ,<br/>● ток холостого хода от АКБ: 30мА,<br/>● шум и пульсации (от сети): 25мВ,<br/>● КПД первичного источника: 87%;● номінальна вихідна потужність: 55Вт,<br/>● вихідна напруга (від мережі): 14.1В,<br/>● вихідна напруга (від АКБ): 10.5-13.8В,<br/>● напруга заряду АКБ: 13.8В,<br/>● напруга відключення АКБ: 10.4-10.6В,<br/>● струм відключення АКБ (без мережі): 4.5А,<br/>● вихідний струм на навантаження: 3А,<br/>● струм заряду АКБ: 0.7А,<br/>● ємність АКБ, що рекомендується: 9-12Аг,<br/>● струм підтримки зарядженого АКБ: 20-100мА залежно від типу АКБ,<br/>● струм холостого ходу від АКБ: 30мА,<br/>● шум та пульсації (від мережі): 25мВ,<br/>● ККД первинного джерела: 87%;r;19,9;USD;шт.;;;;https://images.prom.ua/6228974518_besperebojnyj-blok-pitaniya.jpg;+;3;127351912;Источники бесперебойного питания 12-24В;https://prom.ua/Istochnik-besperebojnogo-pitaniya-ibp;;;;;2864529443;99-00019587;14191106;;FARADAY Electronics;;;;Vmin, V;https://oniks.org.ua/p2864529443-besperebojnyj-blok-pitaniya.html;;;-;Ще краща  ціна за 📞;;;;;;;0.240;;;;;Вихідна потужність;Вт;55;Вихідна напруга;В;13.8;Номінальний струм, А;;3;Тип аккумулятора;;9-12Аг;Розмір упаковки (Ш х В х Г);;80 x 45 x 145 мм;Вага брутто;;240;Строк гарантії;;60 міс.;Вага;г;240;Гарантійний термін;міс;60;;;;;;;;;;;;;;;;;;;;;;;;;;;;;;;;;;;;;;;;;;;;;;;;;;;;;;;;;;;;;;;;;;;;;;;;;;;;;;;;;;;;;;;;;;;;;;;;;;;;;;;;;;;;;;;;;;;;;;;;;;;;;;;;;;;;;;;;;;;;;;;;;;;;;;;;;;;;;;;;;;;;;;;;;;;;;;;;;;;;;;;;;;;;;;;;;;;;;;;;;;;;;;;;;;;;;;;;;;;;;;;;;;;;;;;;;;;;;;;;;;;;;;;;;;;;;;;;;;;;;;;;;;;;;;;;;;;;;;;;;;;;;;;;;;;;;;;;;;;;;;;;;;;;;;;;;;;;;;;;;;;;;;;;;;;;;;;;;;;;;;;;;;;;;;;;;;;;;;;;;;;;;;;;;;;;;;;;;;;;;;;;;;;;;;;;;;;;;;;;;;;;;;;;;;;;;;;;;;;;;;;;;;;;;;;;;;;;;;;;;;;;;;;;;;;;;
200891;Вызывная панель NeoLight PRIME FHD Black;Виклична панель NeoLight PRIME FHD Black;ip видеодомофон, комплект видеодомофона, монитор видеодомофона, вызывная панель домофона, видеодомофон wifi, домофон 7 дюймов, домофон 10 дюймов, видеодомофон беспроводной, видеодомофон, видеодомофон с записью, домофон с экраном, видеодомофон для дома, домофон с камерой, комплект домофона;ip відеодомофон, комплект відеодомофона, монітор відеодомофона, викликова панель домофона, відеодомофон wifi, домофон 7 дюймів, домофон 10 дюймів, відеодомофон бездротовий, відеодомофон, відеодомофон з записом, домофон з екраном, відеодомофон для дому, домофон з камерою, комплект домофону;Тип матрицы камеры CMOS, Разрешение камеры 1080p (1920 х 1080) / 800 ТВЛ, Особенности камеры Убираемый ИК-фильтр, Smart IR, DNR, Формат сигнала AHD / TVI / CVI / CVBS, Угол обзора 110°, Тип подсветки Видимая ИК (дальность до 5 м), Тип крепления Настенное, Питание 12В DC/120 мА (от домофона), Габариты 47 х 131 х 20 мм, Вес 650 г, Температура эксплуатации - 30°С ∼ + 60°С, Класс защиты IP66, Материал корпуса Сатинированный металл;Тип матриці камери CMOS, Роздільна здатність камери 1080p (1920 х 1080) / 800 ТВЛ, Особливості камери прибирає ІЧ-фільтр, Smart IR, DNR, Формат сигналу AHD / TVI / CVI / CVBS, Кут огляду 110 °, Тип підсвічування Видима ІЧ (дальність до 5 м), Тип кріплення Настінне, Живлення 12В DC / 120 мА (від домофона), Габарити 47 х 131 х 20 мм, Вага 650 г, Температура експлуатації - 30 ° С ~ + 60 ° С, Клас захисту IP66, Матеріал корпусу сатинований метал;r;52,79;USD;шт.;;;;https://images.prom.ua/6228988692_vyzyvnaya-panel-neolight.jpg;+;2;90718784;Вызывные видеопанели;https://prom.ua/Domofony-videodomofony;;;;;2863455652;99-00005730;3029;;Neolight;;;;VMAX, V;https://oniks.org.ua/p2863455652-vyzyvnaya-panel-neolight.html;;;-;Ще краща  ціна за 📞;;;;;;;0.540;4.7;13.1;2.0;;Камера;;CMOS;Роздільна здатність;;1080p (1920 х 1080) / 800 ТВЛ;Придушення шуму (DNR);;Підтримує;Тип підсвічування;;Прибираємий ІЧ-фільтр, Smart IR до 5 м;Відеостандарт;;AHD / TVI / CVI / CVBS;Кут огляду;;110°;Живлення;;Мережа 12В;Робоча температура;;- 30°С  ∼ + 60°С;Ступінь захисту;;IP66;Монтаж;;настінний;Матеріал;;Металевий сатинований корпус;Розміри;;47 х 131 х 20 мм;У комплекті;;кутовий кронштейн;Розмір упаковки (Ш х В х Г);;180 x 130 x 50 мм;Вага брутто;;540;Строк гарантії;;12 міс.;Роздільна здатність камери (ТВЛ);;800;Роздільна здатність камери (Мп);;2;Захист обладнання від води і пилу IP;;IP66;Ширина;мм;47;Висота;мм;131;Довжина;мм;20;Вага;г;540;Гарантійний термін;міс;12;Тип устройства;;Відеопанель кольорова виклична;;;;;;;;;;;;;;;;;;;;;;;;;;;;;;;;;;;;;;;;;;;;;;;;;;;;;;;;;;;;;;;;;;;;;;;;;;;;;;;;;;;;;;;;;;;;;;;;;;;;;;;;;;;;;;;;;;;;;;;;;;;;;;;;;;;;;;;;;;;;;;;;;;;;;;;;;;;;;;;;;;;;;;;;;;;;;;;;;;;;;;;;;;;;;;;;;;;;;;;;;;;;;;;;;;;;;;;;;;;;;;;;;;;;;;;;;;;;;;;;;;;;;;;;;;;;;;;;;;;;;;;;;;;;;;;;;;;;;;;;;;;;;;;;;;;;;;;;;;;;;;;;;;;;;;;;;;;;;;;;;;;;;;;;;;;;;;;;;;;;;;;;;;;;;;;;;;;;;;;;;;;;;;;;;;;;;;;;;;;;;;;;;;;;;;;;;;;;;;;;;;;;;
