201580;Wi-Fi роутер TP-LINK Archer C54 Wi-Fi 5;Wi-Fi роутер TP-LINK Archer C54 Wi-Fi 5;Wi-Fi, TP-LINK Wi-Fi, роутер dual band, гигабитный роутер, роутер с usb, mesh роутер, роутер с мощным сигналом, роутер, wifi роутер, маршрутизатор, роутер для дома;Wi-Fi, TP-LINK Wi-Fi, роутер dual band, гігабітний роутер, роутер з usb, mesh роутер, роутер з потужним сигналом, роутер, wifi роутер, маршрутизатор, роутер для дому;● Wi-Fi 5 IEEE 802.11ac/n/a 5 ГГц, IEEE 802.11n/b/g 2,4 ГГц,<br/>● AC1200 5 ГГц: 867 Мбит/с (802.11ac), 2,4 ГГц: 300 Мбит/с (802.11n),<br/>● 1 × 100М порт WAN, 4 × 100М порта LAN,<br/>● Питание 9 В 0.85 А;● Wi-Fi 5 IEEE 802.11ac/n/a 5 ГГц, IEEE 802.11n/b/g 2,4 ГГц,<br/>● AC1200 5 ГГц: 867 Мбіт/с (802.11ac), 2,4 ГГц: 300 Мбіт/с (802.11n),<br/>● 1×100М порт WAN, 4×100М порту LAN,<br/>● Живлення 9 В 0.85 А;r;30,38;USD;шт.;;;;https://images.prom.ua/6228966186_wi-fi-router-tp-link.jpg, https://images.prom.ua/6992255322_wi-fi-router-tp-link.jpg;-;0;90997677;Маршрутизаторы;https://prom.ua/Routeryi;;;;;2863456388;99-00021704;71902;;TP-Link;;;;Vmin, V;https://oniks.org.ua/p2863456388-router-link-archer.html;;;-;Ще краща  ціна за 📞;;;;;;;0.480;;;;;Розмір упаковки (Ш х В х Г);;230 x 80 x 245 мм;Вага брутто;;480;Розміри;;115×106.7×24.3 мм;Питание;;9ВDC/0.85A;Особенности;;Мережевий екран SPI, Керування доступом, Прив'язка IP- и MAC-адрес, Шлюз прикладного рівня;Wi-Fi;;5 ГГц: 867Мб/с, 2.4 ГГц: 300 Мб/с;Ethernet порти (Uplink);;1× 100М WAN;Ethernet порти (DownLink);;4× 100М LAN;;;;;;;;;;;;;;;;;;;;;;;;;;;;;;;;;;;;;;;;;;;;;;;;;;;;;;;;;;;;;;;;;;;;;;;;;;;;;;;;;;;;;;;;;;;;;;;;;;;;;;;;;;;;;;;;;;;;;;;;;;;;;;;;;;;;;;;;;;;;;;;;;;;;;;;;;;;;;;;;;;;;;;;;;;;;;;;;;;;;;;;;;;;;;;;;;;;;;;;;;;;;;;;;;;;;;;;;;;;;;;;;;;;;;;;;;;;;;;;;;;;;;;;;;;;;;;;;;;;;;;;;;;;;;;;;;;;;;;;;;;;;;;;;;;;;;;;;;;;;;;;;;;;;;;;;;;;;;;;;;;;;;;;;;;;;;;;;;;;;;;;;;;;;;;;;;;;;;;;;;;;;;;;;;;;;;;;;;;;;;;;;;;;;;;;;;;;;;;;;;;;;;;;;;;;;;;;;;;;;;;;;;;;;;;;;;;;;;;;;;;;;;;;;;;;;;;;;
201668;Блок бесперебойного питания Full Energy BBGP-125W 12В 5А;Блок безперебійного живлення Full Energy BBGP-125W 12В 5А;BBGP-125W, ибп для компьютера, ибп онлайн, ибп для котла, ибп для видеонаблюдения, резервное питание, ибп 1000va, ибп, источник бесперебойного питания, ups, бесперебойник;BBGP-125W, дбж для комп'ютера, дбж онлайн, дбж для котла, дбж для відеоспостереження, резервне живлення, дбж 1000va, джерело безперебійного живлення, дбж, ups, безперебійник;Бесперебойный блок питания уличный, импульсный, одноканальный. Питание AC100-240В/50-60Hz клеммник, выходное напряжение DC12...14В/5A, клеммник. Защита от перенапряжения, КЗ, перегрузки по току, а также защита заряда/разряда аккумулятора. Корпус пластиковый с крышкой. Класс защиты IP66. Размеры: 260х184х94 мм.;Безперебійний блок живлення зовнішній, імпульсний, одноканальний. живлення AC100-240В / 50-60Hz клеммник, вихідна напруга DC12 ... 14В / 5A, клеммник. Захист від перенапруги, КЗ, перевантаження по струму, а також захист заряду / розряду акумулятора. Корпус пластиковий з кришкою. Клас захисту IP66. Розміри: 260х184х94 мм.;r;25,38;USD;шт.;;;;https://images.prom.ua/5393630161_blok-besperebojnogo-pitaniya.jpg;-;0;127351912;Источники бесперебойного питания 12-24В;https://prom.ua/Istochnik-besperebojnogo-pitaniya-ibp;;;;;2863456487;99-00005398;14191106;;Full Energy;;;;Vmin, V;https://oniks.org.ua/p2863456487-blok-besperebojnogo-pitaniya.html;;;-;Ще краща  ціна за 📞;;;;;;;1.000;26.0;18.4;9.4;;Розмір упаковки (Ш х В х Г);;184 x 260 x 94 мм;Вага брутто;;1000;Розміри;;260 х 184 х 94 мм;Строк гарантії;;12 міс.;Рабочая температура;;-20 ~ +60;Довжина;мм;94;Ширина;мм;260;Гарантійний термін;міс;12;Висота;мм;184;Вес;г;1000;Тип устройства;;Блок безперебійного живлення;Класс защиты;;IP66;Вихідна напруга;В;12;Входное напряжение;;100–240В;Максимальна вхідна напруга;В;240;Мінімальна вхідна напруга;В;100;Сила струму на виході;;5 А;Минимальная рабочая температура;град.;-20;Максимальная рабочая температура;град.;60;Кількість каналів навантаження;;1;Підтримка АКБ;;7 Аг;;;;;;;;;;;;;;;;;;;;;;;;;;;;;;;;;;;;;;;;;;;;;;;;;;;;;;;;;;;;;;;;;;;;;;;;;;;;;;;;;;;;;;;;;;;;;;;;;;;;;;;;;;;;;;;;;;;;;;;;;;;;;;;;;;;;;;;;;;;;;;;;;;;;;;;;;;;;;;;;;;;;;;;;;;;;;;;;;;;;;;;;;;;;;;;;;;;;;;;;;;;;;;;;;;;;;;;;;;;;;;;;;;;;;;;;;;;;;;;;;;;;;;;;;;;;;;;;;;;;;;;;;;;;;;;;;;;;;;;;;;;;;;;;;;;;;;;;;;;;;;;;;;;;;;;;;;;;;;;;;;;;;;;;;;;;;;;;;;;;;;;;;;;;;;;;;;;;;;;;;;;;;;;;;;;;;;;;;;;;;;;;;;;;;;;;;;;;;;;;;;;;;;;;;;;;;;;;;
201176;Электрозащелка CISA 15160 НЗ-АЕ;Електрозащіпка CISA 15160 НЗ-АЕ;электрозамок для двери, замок соленоидный, замок с электроприводом, замок для калитки электрический, замок врезной, замок накладной, электромеханический замок, электромагнитный замок, замок для системы контроля доступа, замок электрический;електрозамок для дверей, замок соленоїдний, замок з електроприводом, замок для хвіртки електричний, замок врізний, замок накладний, електромеханічний замок, електромагнітний замок, замок для системи контролю доступу, замок електричний;● Электромеханическая защелка CISA 15160.00.0 – это элемент системы контроля доступа, обеспечивающий надежную фиксацию двери в закрытом состоянии,<br/>● Устанавливается врезным методом в коробку металлической, деревянной и металлопластиковой двери,<br/>● Совместима с большинством стандартных врезных замков, в которых присутствует язычок,<br/>● Подходит для лево и правосторонней двери,<br/>● Электрозащелка работает в нормально закрытом состоянии. Закрыта без питания, а отпирание происходит подачей напряжения,<br/>● На корпусе присутствует специальный рычаг, переводящий электрозащелку в постоянно открытое состояние,<br/>● Напряжение составляет 12 В переменного/постоянного тока,<br/>● После кратковременной подачи тока защелка остается открытой до открытия-закрытия двери (функция механической памяти).;● Електромеханічна клямка CISA 15160.00.0 – це елемент системи контролю доступу, що забезпечує надійну фіксацію дверей у закритому стані,<br/>● Встановлюється врізним методом у коробку металевих, дерев'яних та металопластикових дверей,<br/>● Сумісна з більшістю стандартних врізних замків, у яких є язичок,<br/>● Підходить для лівого та правостороннього дверей,<br/>● Електрозасувка працює у нормально закритому стані. Закрита без живлення, а відмикання відбувається подачею напруги,<br/>● На корпусі є спеціальний важіль, що переводить електрозасувку в постійно відкритий стан,<br/>● Напруга становить 12 В змінного/постійного струму,<br/>● Після короткочасної подачі струму засувка залишається відкритою до відкриття-закриття дверей (функція механічної пам'яті).;r;33,38;USD;шт.;;;;https://images.prom.ua/6464898621_elektrozaschelka-cisa-15160.jpg;+;1;90997501;Замки и турникеты;https://prom.ua/Mehanicheskie-zamki;;;;;2863455986;99-00019879;301010;;Cisa;;;;Vmin, V;https://oniks.org.ua/p2863455986-elektrozaschelka-cisa-15160.html;;;-;Ще краща  ціна за 📞;;;;;;;0.160;2.1;2.9;7.0;;Живлення;;Мережа 12В;Розміри;;70 х 21 х 29 мм;Матеріал;;Нержавіючий цинк-алюмінієвий сплав;Розмір упаковки (Ш х В х Г);;35 x 25 x 75 мм;Вага брутто;;160;Строк гарантії;;12 міс.;Ширина;мм;70;Висота;мм;21;Довжина;мм;29;Матеріал замку;;Цинковий сплав;Вага;г;160;Гарантійний термін;міс;12;;;;;;;;;;;;;;;;;;;;;;;;;;;;;;;;;;;;;;;;;;;;;;;;;;;;;;;;;;;;;;;;;;;;;;;;;;;;;;;;;;;;;;;;;;;;;;;;;;;;;;;;;;;;;;;;;;;;;;;;;;;;;;;;;;;;;;;;;;;;;;;;;;;;;;;;;;;;;;;;;;;;;;;;;;;;;;;;;;;;;;;;;;;;;;;;;;;;;;;;;;;;;;;;;;;;;;;;;;;;;;;;;;;;;;;;;;;;;;;;;;;;;;;;;;;;;;;;;;;;;;;;;;;;;;;;;;;;;;;;;;;;;;;;;;;;;;;;;;;;;;;;;;;;;;;;;;;;;;;;;;;;;;;;;;;;;;;;;;;;;;;;;;;;;;;;;;;;;;;;;;;;;;;;;;;;;;;;;;;;;;;;;;;;;;;;;;;;;;;;;;;;;;;;;;;;;;;;;;;;;;;;;;;;;;;;;;;;;;;;;;;;
201923;Бокс телекоммуникационный БК-550-3-1-2U К-4549;Бокс телекомунікаційний БК-550-3-1-2U К-4549;шкаф 19 дюймов, шкаф 42u, шкаф 27u, шкаф 32u, серверный шкаф напольный, шкаф настенный 19, шкаф серверный 600x800, шкаф серверный 600x600, шкаф с перфорацией, шкаф для коммутационного оборудования, серверный шкаф, стойка серверная, телекоммуникационный шкаф, сетевой шкаф, шкаф для серверов, антивандальний шкаф, уличный шкаф, електрощит, металлический корпус, ударопрочный шкаф, металлический ящик;шафа 19 дюймів, шафа 42u, шафа 27u, шафа 32u, серверна шафа підлогова, шафа настінна 19, шафа серверна 600x800, шафа серверна 600x600, шафа з перфорацією, шафа для комутаційного обладнання, серверна шафа, стійка серверна, телекомунікаційна шафа, мережева шафа, шафа для серверів, антивандальна шафа, вулична шафа, електрощит, металевий корпус, ударостійка шафа, металевий ящик;"● Высота, U 2,<br/>● Ширина 550,<br/>● Глубина 150,<br/>● Конструкция 19"""",<br/>● Максимальная нагрузка 60 кг,<br/>● Двери глухая, пенальная,<br/>● Ввод кабеля d=22-8 шт,<br/>● Замок Сувальдный,<br/>● Степень защиты IP20";"● Висота, U 2,<br/>● Ширина 550,<br/>● Глибина 150,<br/>● Конструкція 19"""",<br/>● Максимальне навантаження 60 кг,<br/>● Двері глухі, пінальні,<br/>● Введення кабелю d=22-8 шт,<br/>● Замок Сувальдний,<br/>● Ступінь захисту IP20";r;42,33;USD;шт.;;;;https://images.prom.ua/6980532886_boks-telekommunikatsionnyj-bk-550-3-1-2u.jpg;+;1;17012456;Серверные шкафы;https://prom.ua/Shkafy-servernye;;;;;2863456844;00-00000106;70306;;;;;;Vmin, V;https://oniks.org.ua/p2863456844-boks-telekommunikatsionnyj-550.html;;;-;Ще краща  ціна за 📞;;;;;;;7.620;;;;;Розмір;;150х550х500 мм;Клас захисту;;IP20;Максимальне навантаження;;60 кг;Замок;;сувальдний;Вага;кг;7.62;Розмір упаковки (Ш х В х Г);;160 x 500 x 550 мм;Вага брутто;;7620;Передні двері;;З замком;;;;;;;;;;;;;;;;;;;;;;;;;;;;;;;;;;;;;;;;;;;;;;;;;;;;;;;;;;;;;;;;;;;;;;;;;;;;;;;;;;;;;;;;;;;;;;;;;;;;;;;;;;;;;;;;;;;;;;;;;;;;;;;;;;;;;;;;;;;;;;;;;;;;;;;;;;;;;;;;;;;;;;;;;;;;;;;;;;;;;;;;;;;;;;;;;;;;;;;;;;;;;;;;;;;;;;;;;;;;;;;;;;;;;;;;;;;;;;;;;;;;;;;;;;;;;;;;;;;;;;;;;;;;;;;;;;;;;;;;;;;;;;;;;;;;;;;;;;;;;;;;;;;;;;;;;;;;;;;;;;;;;;;;;;;;;;;;;;;;;;;;;;;;;;;;;;;;;;;;;;;;;;;;;;;;;;;;;;;;;;;;;;;;;;;;;;;;;;;;;;;;;;;;;;;;;;;;;;;;;;;;;;;;;;;;;;;;;;;;;;;;;;;;;;;;;;;;
200036;Литиевая аккумуляторная батарея Li-TIME 12.8В 100А•ч 100А;Літієва акумуляторна батарея Li-TIME 12.8В 100А•год 100А;Li-TIME, аккумулятор 12в 7ah, аккумулятор для ups, аккумулятор 12в 9ah, свинцово кислотный аккумулятор, аккумуляторная батарея 12в, аккумулятор 12в 12ah, аккумулятор 12в, аккумулятор для ибп, аккумулятор agm, гелевый аккумулятор, литий-железо-фосфатный аккумулятор, аккумулятор для дрона, аккумулятор в квадрокоптер;Li-TIME, акумулятор 12в 7ah, акумулятор для ups, акумулятор 12в 9ah, свинцево кислотний акумулятор, акумуляторна батарея 12в, акумулятор 12в 12ah, акумулятор 12в, акумулятор для дбж, акумулятор agm, гелевий акумулятор, літій-залізо-фосфатний акумулятор, акумулятор для дрону, акумулятор в квадрокоптер;● Тип аккумулятора: LiFePo4 – литий-железо-фосфат,<br/>● Выходное напряжение: 12,8 В,<br/>● Емкость: 100 А●ч,<br/>● Максимальный ток заряда/разряда: 100А,<br/>● Размеры: 329x172x214 мм,<br/>● 10 кг;● Тип акумулятора: LiFePo4 – літій-залізо-фосфат,<br/>● Вихідна напруга: 12,8 В,<br/>● Місткість: 100  А●г,<br/>● Максимальний струм заряду/розряду: 100А,<br/>● Розміри: 329x172x214 мм,<br/>● 10 кг;r;411,15;USD;шт.;;;;https://images.prom.ua/6961220451_litievaya-akkumulyatornaya-batareya.jpg;-;0;144038788;Литивые аккумуляторы;https://prom.ua/Akkumulyatornye-bloki;;;;;2867075626;99-00023777;5280501;;;;;;Vmin, V;https://oniks.org.ua/p2867075626-litievaya-akkumulyatornaya-batareya.html;;;-;Ще краща  ціна за 📞;;;;;;;10.680;32.9;17.2;21.4;;Розмір упаковки (Ш х В х Г);;255 x 295 x 405 мм;Вага брутто;;10680;Розміри;;329x172x214 мм;Довжина;мм;214;Ширина;мм;329;Висота;мм;172;Вес;г;10000;Особенности;;Максимальний струм заряду/розряду: 100А;Емкость;;100  А●г;Ємність акумулятору;А. г;100;Напруга;В;12,8;Тип акумулятора;;LiFePO4;Выходное напряжение;В;12.8 В;;;;;;;;;;;;;;;;;;;;;;;;;;;;;;;;;;;;;;;;;;;;;;;;;;;;;;;;;;;;;;;;;;;;;;;;;;;;;;;;;;;;;;;;;;;;;;;;;;;;;;;;;;;;;;;;;;;;;;;;;;;;;;;;;;;;;;;;;;;;;;;;;;;;;;;;;;;;;;;;;;;;;;;;;;;;;;;;;;;;;;;;;;;;;;;;;;;;;;;;;;;;;;;;;;;;;;;;;;;;;;;;;;;;;;;;;;;;;;;;;;;;;;;;;;;;;;;;;;;;;;;;;;;;;;;;;;;;;;;;;;;;;;;;;;;;;;;;;;;;;;;;;;;;;;;;;;;;;;;;;;;;;;;;;;;;;;;;;;;;;;;;;;;;;;;;;;;;;;;;;;;;;;;;;;;;;;;;;;;;;;;;;;;;;;;;;;;;;;;;;;;;;;;;;;;;;;;;;;;;;;;;;;;;;;;;;;;;;;;;;
200588;Жорсткий диск SEAGATE HDD Server Exos X18 HDD 512E/4KN;Жесткий диск SEAGATE HDD Server Exos X18 HDD 512E/4KN;hdd 1tb, hdd 2tb, hdd 4tb, hdd 6tb, hdd 8tb, hdd purple, жесткий диск skyhawk, hdd для регистратора, жесткий диск 3.5, жесткий диск western digital, жесткий диск seagate, жесткий диск wd, диск для видеонаблюдения, жесткий диск для видеонаблюдения, hdd для видеорегистратора, жесткий диск surveillance, винчестер для видеонаблюдения;hdd 1tb, hdd 2tb, hdd 4tb, hdd 6tb, hdd 8tb, hdd purple, жорсткий диск skyhawk, hdd для реєстратора, жорсткий диск 3.5, жорсткий диск western digital, жорсткий диск seagate, жорсткий диск wd, диск для відеоспостереження, жорсткий диск для відеоспостереження, hdd для відеореєстратора, жорсткий диск surveillance, вінчестер для відеоспостереження;"● Емкость накопителя 16 ТБ,<br/>● Тип жесткого диска         внутренний,<br/>● Интерфейс подключения SATAIII,<br/>● Форм-фактор       3.5"""",<br/>● Скорость вращения шпинделя 7200 об/мин";"● Місткість накопичувача         16 ТБ,<br/>● Тип жорсткого диска         Внутрішній,<br/>● Інтерфейс підключення        SATAIII,<br/>● Форм-фактор        3.5"""",<br/>● Швидкість обертання шпинделя        7200 об/хв";r;499,08;USD;шт.;;;;https://images.prom.ua/6999934556_zhorstkij-disk-seagate.jpg;-;0;83889367;Накопители для видеонаблюдения;https://prom.ua/Zhestkie-diski;;;;;2868094871;99-10026651;70704;;Seagate;;;;Vmin, V;https://oniks.org.ua/p2868094871-zhorstkij-disk-seagate.html;;;-;Ще краща  ціна за 📞;;;;;;;0.660;;;;;Розмір упаковки (Ш х В х Г);;150 x 25 x 100 мм;Вага брутто;;660;Вага;г;660;Форм-фактор;;"3.5""";Емкость;;16 ТБ;Інтерфейс;;SATA III (SATA/600);Інтерфейс користувача;;SATAIII;Об'єм накопичувача;GB;16384;Тип диска;;HDD;Швидкість обертання;об/хв;7200;Швидкість обертання (об / хв);;7200;;;;;;;;;;;;;;;;;;;;;;;;;;;;;;;;;;;;;;;;;;;;;;;;;;;;;;;;;;;;;;;;;;;;;;;;;;;;;;;;;;;;;;;;;;;;;;;;;;;;;;;;;;;;;;;;;;;;;;;;;;;;;;;;;;;;;;;;;;;;;;;;;;;;;;;;;;;;;;;;;;;;;;;;;;;;;;;;;;;;;;;;;;;;;;;;;;;;;;;;;;;;;;;;;;;;;;;;;;;;;;;;;;;;;;;;;;;;;;;;;;;;;;;;;;;;;;;;;;;;;;;;;;;;;;;;;;;;;;;;;;;;;;;;;;;;;;;;;;;;;;;;;;;;;;;;;;;;;;;;;;;;;;;;;;;;;;;;;;;;;;;;;;;;;;;;;;;;;;;;;;;;;;;;;;;;;;;;;;;;;;;;;;;;;;;;;;;;;;;;;;;;;;;;;;;;;;;;;;;;;;;;;;;;;;;;;;;;;;;;;;;;;;;
200707;Защитная решетка для камер (белая) DS 102/66w;Захисна решітка для камер (біла) DS 102/66w;кронштейн настенный, кронштейн потолочный, термокожух для камеры, коробка распределительная, монтажная коробка, кронштейн металлический, кронштейн поворотный, кронштейн для камеры видеонаблюдения, кожух для камеры, крепление для камеры, аксессуары для видеонаблюдения;кронштейн настінний, кронштейн стельовий, термокожух для камери, коробка розподільча, монтажна коробка, кронштейн металевий, кронштейн поворотний, кронштейн для камери відеоспостереження, кожух для камери, кріплення для камери, аксесуари для відеоспостереження;Внутренний диаметр кожуха- 102 мм. Наружный диаметр кожуха -139 мм. Высота кожуха - 66 мм. Для купольных видеокамер DS-2CE56D0T-IRMF, DS-2CE56D8T-ITME, DS-2CE56D8T-ITMF, DS-2CE56F7T-IT3Z, DS-2CE56D8T-IT3ZE.<br/><br/><br/>;Внутрішній діаметр кожуха- 102 мм. Зовнішній діаметр кожуха -139 мм. Висота кожуха - 66 мм. Для купольних відеокамер DS-2CE56D0T-IRMF, DS-2CE56D8T-ITME, DS-2CE56D8T-ITMF, DS-2CE56F7T-IT3Z, DS-2CE56D8T-IT3ZE.;r;7,9;USD;шт.;;;;https://images.prom.ua/4038277446_zaschitnaya-reshetka-dlya.jpg;-;0;4321341;Комплектующие для видеонаблюдения;https://prom.ua/Kozhuhi-i-kronshtejny;;;;;2863455391;99-00005803;301112;;Hikvision;;;;VMAX, V;https://oniks.org.ua/p2863455391-zaschitnaya-reshetka-dlya.html;;;-;Ще краща  ціна за 📞;;;;;;;0.150;;;;;Розмір упаковки (Ш х В х Г);;110 x 110 x 70 мм;Вага брутто;;150;Вага;г;150;Сумісний з серіями камер;;DS-2CE56D0T-IRMF, DS-2CE56D8T-ITME, DS-2CE56D8T-ITMF, DS-2CE56F7T-IT3Z, DS-2CE56D8T-IT3ZE;;;;;;;;;;;;;;;;;;;;;;;;;;;;;;;;;;;;;;;;;;;;;;;;;;;;;;;;;;;;;;;;;;;;;;;;;;;;;;;;;;;;;;;;;;;;;;;;;;;;;;;;;;;;;;;;;;;;;;;;;;;;;;;;;;;;;;;;;;;;;;;;;;;;;;;;;;;;;;;;;;;;;;;;;;;;;;;;;;;;;;;;;;;;;;;;;;;;;;;;;;;;;;;;;;;;;;;;;;;;;;;;;;;;;;;;;;;;;;;;;;;;;;;;;;;;;;;;;;;;;;;;;;;;;;;;;;;;;;;;;;;;;;;;;;;;;;;;;;;;;;;;;;;;;;;;;;;;;;;;;;;;;;;;;;;;;;;;;;;;;;;;;;;;;;;;;;;;;;;;;;;;;;;;;;;;;;;;;;;;;;;;;;;;;;;;;;;;;;;;;;;;;;;;;;;;;;;;;;;;;;;;;;;;;;;;;;;;;;;;;;;;;;;;;;;;;;;;;;;;;;;;;;;;
