Код_товару;Назва_позиції;Назва_позиції_укр;Пошукові_запити;Пошукові_запити_укр;Опис;Опис_укр;Тип_товару;Ціна;Валюта;Одиниця_виміру;Мінімальний_обсяг_замовлення;Оптова_ціна;Мінімальне_замовлення_опт;Посилання_зображення;Наявність;Кількість;Номер_групи;Назва_групи;Посилання_підрозділу;Можливість_поставки;Термін_поставки;Спосіб_пакування;Спосіб_пакування_укр;Унікальний_ідентифікатор;Ідентифікатор_товару;Ідентифікатор_підрозділу;Ідентифікатор_групи;Виробник;Країна_виробник;Знижка;ID_групи_різновидів;Особисті_нотатки;Продукт_на_сайті;Термін_дії_знижки_від;Термін_дії_знижки_до;Ціна_від;Ярлик;HTML_заголовок;HTML_заголовок_укр;HTML_опис;HTML_опис_укр;Код_маркування_(GTIN);Номер_пристрою_(MPN);Вага,кг;Ширина,см;Висота,см;Довжина,см;Де_знаходиться_товар;Назва_Характеристики;Одиниця_виміру_Характеристики;Значення_Характеристики;Назва_Характеристики;Одиниця_виміру_Характеристики;Значення_Характеристики;Назва_Характеристики;Одиниця_виміру_Характеристики;Значення_Характеристики;Назва_Характеристики;Одиниця_виміру_Характеристики;Значення_Характеристики;Назва_Характеристики;Одиниця_виміру_Характеристики;Значення_Характеристики;Назва_Характеристики;Одиниця_виміру_Характеристики;Значення_Характеристики;Назва_Характеристики;Одиниця_виміру_Характеристики;Значення_Характеристики;Назва_Характеристики;Одиниця_виміру_Характеристики;Значення_Характеристики;Назва_Характеристики;Одиниця_виміру_Характеристики;Значення_Характеристики;Назва_Характеристики;Одиниця_виміру_Характеристики;Значення_Характеристики;Назва_Характеристики;Одиниця_виміру_Характеристики;Значення_Характеристики;Назва_Характеристики;Одиниця_виміру_Характеристики;Значення_Характеристики;Назва_Характеристики;Одиниця_виміру_Характеристики;Значення_Характеристики;Назва_Характеристики;Одиниця_виміру_Характеристики;Значення_Характеристики;Назва_Характеристики;Одиниця_виміру_Характеристики;Значення_Характеристики;Назва_Характеристики;Одиниця_виміру_Характеристики;Значення_Характеристики;Назва_Характеристики;Одиниця_виміру_Характеристики;Значення_Характеристики;Назва_Характеристики;Одиниця_виміру_Характеристики;Значення_Характеристики;Назва_Характеристики;Одиниця_виміру_Характеристики;Значення_Характеристики;Назва_Характеристики;Одиниця_виміру_Характеристики;Значення_Характеристики;Назва_Характеристики;Одиниця_виміру_Характеристики;Значення_Характеристики;Назва_Характеристики;Одиниця_виміру_Характеристики;Значення_Характеристики;Назва_Характеристики;Одиниця_виміру_Характеристики;Значення_Характеристики;Назва_Характеристики;Одиниця_виміру_Характеристики;Значення_Характеристики;Назва_Характеристики;Одиниця_виміру_Характеристики;Значення_Характеристики;Назва_Характеристики;Одиниця_виміру_Характеристики;Значення_Характеристики;Назва_Характеристики;Одиниця_виміру_Характеристики;Значення_Характеристики;Назва_Характеристики;Одиниця_виміру_Характеристики;Значення_Характеристики;Назва_Характеристики;Одиниця_виміру_Характеристики;Значення_Характеристики;Назва_Характеристики;Одиниця_виміру_Характеристики;Значення_Характеристики;Назва_Характеристики;Одиниця_виміру_Характеристики;Значення_Характеристики;Назва_Характеристики;Одиниця_виміру_Характеристики;Значення_Характеристики;Назва_Характеристики;Одиниця_виміру_Характеристики;Значення_Характеристики;Назва_Характеристики;Одиниця_виміру_Характеристики;Значення_Характеристики;Назва_Характеристики;Одиниця_виміру_Характеристики;Значення_Характеристики;Назва_Характеристики;Одиниця_виміру_Характеристики;Значення_Характеристики;Назва_Характеристики;Одиниця_виміру_Характеристики;Значення_Характеристики;Назва_Характеристики;Одиниця_виміру_Характеристики;Значення_Характеристики;Назва_Характеристики;Одиниця_виміру_Характеристики;Значення_Характеристики;Назва_Характеристики;Одиниця_виміру_Характеристики;Значення_Характеристики;Назва_Характеристики;Одиниця_виміру_Характеристики;Значення_Характеристики;Назва_Характеристики;Одиниця_виміру_Характеристики;Значення_Характеристики;Назва_Характеристики;Одиниця_виміру_Характеристики;Значення_Характеристики;Назва_Характеристики;Одиниця_виміру_Характеристики;Значення_Характеристики;Назва_Характеристики;Одиниця_виміру_Характеристики;Значення_Характеристики;Назва_Характеристики;Одиниця_виміру_Характеристики;Значення_Характеристики;Назва_Характеристики;Одиниця_виміру_Характеристики;Значення_Характеристики;Назва_Характеристики;Одиниця_виміру_Характеристики;Значення_Характеристики;Назва_Характеристики;Одиниця_виміру_Характеристики;Значення_Характеристики;Назва_Характеристики;Одиниця_виміру_Характеристики;Значення_Характеристики;Назва_Характеристики;Одиниця_виміру_Характеристики;Значення_Характеристики;Назва_Характеристики;Одиниця_виміру_Характеристики;Значення_Характеристики;Назва_Характеристики;Одиниця_виміру_Характеристики;Значення_Характеристики;Назва_Характеристики;Одиниця_виміру_Характеристики;Значення_Характеристики;Назва_Характеристики;Одиниця_виміру_Характеристики;Значення_Характеристики;Назва_Характеристики;Одиниця_виміру_Характеристики;Значення_Характеристики;Назва_Характеристики;Одиниця_виміру_Характеристики;Значення_Характеристики;Назва_Характеристики;Одиниця_виміру_Характеристики;Значення_Характеристики;Назва_Характеристики;Одиниця_виміру_Характеристики;Значення_Характеристики;Назва_Характеристики;Одиниця_виміру_Характеристики;Значення_Характеристики;Назва_Характеристики;Одиниця_виміру_Характеристики;Значення_Характеристики;Назва_Характеристики;Одиниця_виміру_Характеристики;Значення_Характеристики;Назва_Характеристики;Одиниця_виміру_Характеристики;Значення_Характеристики;Назва_Характеристики;Одиниця_виміру_Характеристики;Значення_Характеристики;Назва_Характеристики;Одиниця_виміру_Характеристики;Значення_Характеристики;Назва_Характеристики;Одиниця_виміру_Характеристики;Значення_Характеристики;Назва_Характеристики;Одиниця_виміру_Характеристики;Значення_Характеристики;Назва_Характеристики;Одиниця_виміру_Характеристики;Значення_Характеристики;Назва_Характеристики;Одиниця_виміру_Характеристики;Значення_Характеристики;Назва_Характеристики;Одиниця_виміру_Характеристики;Значення_Характеристики;Назва_Характеристики;Одиниця_виміру_Характеристики;Значення_Характеристики;Назва_Характеристики;Одиниця_виміру_Характеристики;Значення_Характеристики;Назва_Характеристики;Одиниця_виміру_Характеристики;Значення_Характеристики;Назва_Характеристики;Одиниця_виміру_Характеристики;Значення_Характеристики;Назва_Характеристики;Одиниця_виміру_Характеристики;Значення_Характеристики;Назва_Характеристики;Одиниця_виміру_Характеристики;Значення_Характеристики;Назва_Характеристики;Одиниця_виміру_Характеристики;Значення_Характеристики;Назва_Характеристики;Одиниця_виміру_Характеристики;Значення_Характеристики;Назва_Характеристики;Одиниця_виміру_Характеристики;Значення_Характеристики;Назва_Характеристики;Одиниця_виміру_Характеристики;Значення_Характеристики;Назва_Характеристики;Одиниця_виміру_Характеристики;Значення_Характеристики;Назва_Характеристики;Одиниця_виміру_Характеристики;Значення_Характеристики;Назва_Характеристики;Одиниця_виміру_Характеристики;Значення_Характеристики;Назва_Характеристики;Одиниця_виміру_Характеристики;Значення_Характеристики;Назва_Характеристики;Одиниця_виміру_Характеристики;Значення_Характеристики;Назва_Характеристики;Одиниця_виміру_Характеристики;Значення_Характеристики;Назва_Характеристики;Одиниця_виміру_Характеристики;Значення_Характеристики;Назва_Характеристики;Одиниця_виміру_Характеристики;Значення_Характеристики;Назва_Характеристики;Одиниця_виміру_Характеристики;Значення_Характеристики;Назва_Характеристики;Одиниця_виміру_Характеристики;Значення_Характеристики;Назва_Характеристики;Одиниця_виміру_Характеристики;Значення_Характеристики;Назва_Характеристики;Одиниця_виміру_Характеристики;Значення_Характеристики;Назва_Характеристики;Одиниця_виміру_Характеристики;Значення_Характеристики;Назва_Характеристики;Одиниця_виміру_Характеристики;Значення_Характеристики;Назва_Характеристики;Одиниця_виміру_Характеристики;Значення_Характеристики;Назва_Характеристики;Одиниця_виміру_Характеристики;Значення_Характеристики;Назва_Характеристики;Одиниця_виміру_Характеристики;Значення_Характеристики;Назва_Характеристики;Одиниця_виміру_Характеристики;Значення_Характеристики;Назва_Характеристики;Одиниця_виміру_Характеристики;Значення_Характеристики;Назва_Характеристики;Одиниця_виміру_Характеристики;Значення_Характеристики;Назва_Характеристики;Одиниця_виміру_Характеристики;Значення_Характеристики;Назва_Характеристики;Одиниця_виміру_Характеристики;Значення_Характеристики;Назва_Характеристики;Одиниця_виміру_Характеристики;Значення_Характеристики;Назва_Характеристики;Одиниця_виміру_Характеристики;Значення_Характеристики;Назва_Характеристики;Одиниця_виміру_Характеристики;Значення_Характеристики;Назва_Характеристики;Одиниця_виміру_Характеристики;Значення_Характеристики;Назва_Характеристики;Одиниця_виміру_Характеристики;Значення_Характеристики;Назва_Характеристики;Одиниця_виміру_Характеристики;Значення_Характеристики;Назва_Характеристики;Одиниця_виміру_Характеристики;Значення_Характеристики;Назва_Характеристики;Одиниця_виміру_Характеристики;Значення_Характеристики;Назва_Характеристики;Одиниця_виміру_Характеристики;Значення_Характеристики;Назва_Характеристики;Одиниця_виміру_Характеристики;Значення_Характеристики;Назва_Характеристики;Одиниця_виміру_Характеристики;Значення_Характеристики;Назва_Характеристики;Одиниця_виміру_Характеристики;Значення_Характеристики;Назва_Характеристики;Одиниця_виміру_Характеристики;Значення_Характеристики;Назва_Характеристики;Одиниця_виміру_Характеристики;Значення_Характеристики;Назва_Характеристики;Одиниця_виміру_Характеристики;Значення_Характеристики;Назва_Характеристики;Одиниця_виміру_Характеристики;Значення_Характеристики;Назва_Характеристики;Одиниця_виміру_Характеристики;Значення_Характеристики;Назва_Характеристики;Одиниця_виміру_Характеристики;Значення_Характеристики;Назва_Характеристики;Одиниця_виміру_Характеристики;Значення_Характеристики;Назва_Характеристики;Одиниця_виміру_Характеристики;Значення_Характеристики;Назва_Характеристики;Одиниця_виміру_Характеристики;Значення_Характеристики;Назва_Характеристики;Одиниця_виміру_Характеристики;Значення_Характеристики;Назва_Характеристики;Одиниця_виміру_Характеристики;Значення_Характеристики;Назва_Характеристики;Одиниця_виміру_Характеристики;Значення_Характеристики;Назва_Характеристики;Одиниця_виміру_Характеристики;Значення_Характеристики;Назва_Характеристики;Одиниця_виміру_Характеристики;Значення_Характеристики;Назва_Характеристики;Одиниця_виміру_Характеристики;Значення_Характеристики;Назва_Характеристики;Одиниця_виміру_Характеристики;Значення_Характеристики;Назва_Характеристики;Одиниця_виміру_Характеристики;Значення_Характеристики;Назва_Характеристики;Одиниця_виміру_Характеристики;Значення_Характеристики;Назва_Характеристики;Одиниця_виміру_Характеристики;Значення_Характеристики;Назва_Характеристики;Одиниця_виміру_Характеристики;Значення_Характеристики;Назва_Характеристики;Одиниця_виміру_Характеристики;Значення_Характеристики;Назва_Характеристики;Одиниця_виміру_Характеристики;Значення_Характеристики;Назва_Характеристики;Одиниця_виміру_Характеристики;Значення_Характеристики;Назва_Характеристики;Одиниця_виміру_Характеристики;Значення_Характеристики;Назва_Характеристики;Одиниця_виміру_Характеристики;Значення_Характеристики;Назва_Характеристики;Одиниця_виміру_Характеристики;Значення_Характеристики;Назва_Характеристики;Одиниця_виміру_Характеристики;Значення_Характеристики;Назва_Характеристики;Одиниця_виміру_Характеристики;Значення_Характеристики;Назва_Характеристики;Одиниця_виміру_Характеристики;Значення_Характеристики;Назва_Характеристики;Одиниця_виміру_Характеристики;Значення_Характеристики;Назва_Характеристики;Одиниця_виміру_Характеристики;Значення_Характеристики;Назва_Характеристики;Одиниця_виміру_Характеристики;Значення_Характеристики;Назва_Характеристики;Одиниця_виміру_Характеристики;Значення_Характеристики;Назва_Характеристики;Одиниця_виміру_Характеристики;Значення_Характеристики;Назва_Характеристики;Одиниця_виміру_Характеристики;Значення_Характеристики;Назва_Характеристики;Одиниця_виміру_Характеристики;Значення_Характеристики;Назва_Характеристики;Одиниця_виміру_Характеристики;Значення_Характеристики;Назва_Характеристики;Одиниця_виміру_Характеристики;Значення_Характеристики;Назва_Характеристики;Одиниця_виміру_Характеристики;Значення_Характеристики;Назва_Характеристики;Одиниця_виміру_Характеристики;Значення_Характеристики;Назва_Характеристики;Одиниця_виміру_Характеристики;Значення_Характеристики;Назва_Характеристики;Одиниця_виміру_Характеристики;Значення_Характеристики;Назва_Характеристики;Одиниця_виміру_Характеристики;Значення_Характеристики;Назва_Характеристики;Одиниця_виміру_Характеристики;Значення_Характеристики;Назва_Характеристики;Одиниця_виміру_Характеристики;Значення_Характеристики;Назва_Характеристики;Одиниця_виміру_Характеристики;Значення_Характеристики
200795;Видеодомофон NeoLight KAPPA+ HD;Відеодомофон NeoLight KAPPA+ HD;комплект видеодомофона, монитор видеодомофона, вызывная панель домофона, видеодомофон wifi, домофон 7 дюймов, домофон 10 дюймов, видеодомофон беспроводной, видеодомофон, видеодомофон с записью, домофон с экраном, видеодомофон для дома, домофон с камерой, комплект домофона;комплект відеодомофона, монітор відеодомофона, викликова панель домофона, відеодомофон wifi, домофон 7 дюймів, домофон 10 дюймів, відеодомофон бездротовий, відеодомофон, відеодомофон з записом, домофон з екраном, відеодомофон для дому, домофон з камерою, комплект домофону;"Размер экрана 7"""", Разрешение экрана 1024 х 600, Формат входного сигнала AHD / CVBS, Разрешение входного сигнала 1080p / 720p / 576i, Графическое меню Да, 2 интерфейса, управление через кнопки, Язык меню Украинский/русский/английский, Управление Сенсорные кнопки, Подключение видеодомофонов в интеркоме 4, Встроенный видеорегистратор, Запись аудио, Управление воротами - необходим адаптер NL-GT01, Питание 220В AC, Габариты 210 х 114 х 25 мм";"Розмір екрану 7 """", Роздільна здатність екрану 1024 х 600, Формат вхідного сигналу AHD / CVBS, Роздільна здатність вхідного сигналу 1080p / 720p / 576i, Графічне меню Так, 2 інтерфейси, управління через кнопки, Мова меню Український / російська / англійська, Управління Сенсорні кнопки, підключення відеодомофонів в інтеркомом 4, Вбудований відеореєстратор, Запис аудіо, Управління воротами - необхідний адаптер NL-GT01, Живлення 220В AC Габарити 210 х 114 х 25 мм";r;114,9;USD;шт.;;;;https://images.prom.ua/6228984787_videodomofon-neolight-kappa.jpg, https://images.prom.ua/6992262076_videodomofon-neolight-kappa.jpg;+;3;4328775;Видеодомофоны;https://prom.ua/Domofony-videodomofony;;;;;2863455553;99-00005723;3029;;Neolight;;;;VMAX, V;https://oniks.org.ua/p2863455553-videodomofon-neolight-kappa.html;;;-;Ще краща  ціна за 📞;;;;;;;0.450;21.0;11.4;2.5;;Дисплей;;7″;Роздільна здатність дисплея;;1024 х 600;Метод роботи;;2 інтерфейси, управління через кнопки;Тип сигналу;;AHD / CVBS;Додатково;;Підключення відеодомофонів в інтеркомом 4;Підключення;;2 викличні панелі + 2 відеокамери + 3 додаткових відеодомофона, 1 виклична панель + 3 відеокамери + 3 додаткових відеодомофона;Особливості;;Вбудований реєстратор, запис аудіо, Мультиформатний Full HD сигнал, вбудований блок живлення, кнопка управління воротами, пам'ять, графічне меню (2 види) українською та російською мовою, медіаплеєр, фоторамка, нічний режим, автовідповідач, запис повідомле;Живлення;;Мережа 220В;Монтаж;;настінний;Розміри;;210 х 114 х 25 мм;Розмір упаковки (Ш х В х Г);;116 x 210 x 25 мм;Вага брутто;;450;Строк гарантії;;12 міс.;Роздільна здатність екрану;;1024?600;Входи для підключення;;3;Підключення додаткової камери;;Так;Ширина;мм;210;Висота;мм;114;Довжина;мм;25;Вага;г;450;Гарантійний термін;міс;12;Тип устройства;;Відеодомофон;;;;;;;;;;;;;;;;;;;;;;;;;;;;;;;;;;;;;;;;;;;;;;;;;;;;;;;;;;;;;;;;;;;;;;;;;;;;;;;;;;;;;;;;;;;;;;;;;;;;;;;;;;;;;;;;;;;;;;;;;;;;;;;;;;;;;;;;;;;;;;;;;;;;;;;;;;;;;;;;;;;;;;;;;;;;;;;;;;;;;;;;;;;;;;;;;;;;;;;;;;;;;;;;;;;;;;;;;;;;;;;;;;;;;;;;;;;;;;;;;;;;;;;;;;;;;;;;;;;;;;;;;;;;;;;;;;;;;;;;;;;;;;;;;;;;;;;;;;;;;;;;;;;;;;;;;;;;;;;;;;;;;;;;;;;;;;;;;;;;;;;;;;;;;;;;;;;;;;;;;;;;;;;;;;;;;;;;;;;;;;;;;;;;;;;;;;;;;;;;;;;;;;;;;;;;;;
