201727;Блок питания Kraft KRF-1205PS;Блок живлення Kraft KRF-1205PS;KRF-1205PS, блок питания din рейка, блок питания 24в, блок питания для светодиодной ленты, блок питания mean well, блок питания для камеры, блок питания, импульсный блок питания, блок питания 12в, промышленный блок питания;KRF-1205PS, блок живлення din рейка, блок живлення 24в, блок живлення для світлодіодної стрічки, блок живлення mean well, блок живлення для камери, блок живлення, імпульсний блок живлення, блок живлення 12в, промисловий блок живлення;● Тип блока питания Импульсный,<br/>● Выходное напряжение 12 В,<br/>● Выходной ток 5 А,<br/>● Входное напряжение AC 155-265 В,<br/>● Количество каналов нагрузки 1;● Тип блоку живлення Імпульсний,<br/>● Вихідна напруга 12 В,<br/>● Вихідний струм 5 А,<br/>● Вхідна напруга AC 155-265 В,<br/>● Кількість каналів навантаження 1;r;7,34;USD;шт.;;;;https://images.prom.ua/6787218181_blok-pitaniya-kraft.jpg, https://images.prom.ua/6992261167_blok-pitaniya-kraft.jpg, https://images.prom.ua/6992261169_blok-pitaniya-kraft.jpg;+;100;127351950;Блоки питания;https://prom.ua/Promyshlennye-istochniki-pitaniya;;;;;2863456532;99-10025268;14191103;;Kraft;;;;Vmin, V;https://oniks.org.ua/p2863456532-blok-pitaniya-kraft.html;;;-;Ще краща  ціна за 📞;;;;;;;0.250;12.5;5.5;3.3;;Тип пристрою;;Імпульсний;Потужність;;60 Вт;Вхідна напруга;;AC 155-265 В;Вихідна напруга;В;12;Сила струму на виході;;5А;Захист від короткого замикання;;Так;Кількість каналів навантаження;;1;Розміри;;125 х 55 х 33 мм;Розмір упаковки (Ш х В х Г);;90 x 30 x 170 мм;Вага брутто;;250;Тип блоку живлення;;Імпульсний;Вихідна потужність;Вт;60;Мінімальна вхідна напруга;В;155;Максимальна вхідна напруга;В;265;Вихідний струм, не більше;А;5;Тип;;Промисловий;Ширина;мм;125;Висота;мм;55;Довжина;мм;33;Вага;г;250;;;;;;;;;;;;;;;;;;;;;;;;;;;;;;;;;;;;;;;;;;;;;;;;;;;;;;;;;;;;;;;;;;;;;;;;;;;;;;;;;;;;;;;;;;;;;;;;;;;;;;;;;;;;;;;;;;;;;;;;;;;;;;;;;;;;;;;;;;;;;;;;;;;;;;;;;;;;;;;;;;;;;;;;;;;;;;;;;;;;;;;;;;;;;;;;;;;;;;;;;;;;;;;;;;;;;;;;;;;;;;;;;;;;;;;;;;;;;;;;;;;;;;;;;;;;;;;;;;;;;;;;;;;;;;;;;;;;;;;;;;;;;;;;;;;;;;;;;;;;;;;;;;;;;;;;;;;;;;;;;;;;;;;;;;;;;;;;;;;;;;;;;;;;;;;;;;;;;;;;;;;;;;;;;;;;;;;;;;;;;;;;;;;;;;;;;;;;;;;;;;;;;;;;;;;;;;;;;;;;
201829;Инвертор Deye SUN-20K-SG01HP3-EU-AM2 высоковольтный трехфазный чистая синусоида;Інвертор Deye SUN-20K-SG01HP3-EU-AM2 високовольтний трифазний чиста синусоїда;SUN-20K-SG01HP3-EU-AM2, инвертор 2000w, автомобильный инвертор, инвертор 3000w, солнечный инвертор, инвертор с зарядным устройством, инвертор 1000w, инвертор, преобразователь напряжения, инвертор 12 220, инвертор чистый синус;SUN-20K-SG01HP3-EU-AM2, інвертор 2000w, автомобільний інвертор, інвертор 3000w, сонячний інвертор, інвертор з зарядним пристроєм, інвертор 1000w, інвертор, перетворювач напруги, інвертор 12 220, інвертор чистий синус;● Диапазон напряжения батареи (В) 160-700,<br/>● Макс. зарядный ток (А) 37,<br/>● Макс. входная мощность фотоэлектрических модулей (Вт) 26000,<br/>● Диапазон напряжения MPPT (В) 150–850,<br/>● Номинальная входная/выходная активная мощность переменного тока (Вт) 20000,<br/>● Интерфейс связи CAN,<br/>● IP 65;● Діапазон напруги батареї (B) 160-700,<br/>● Макс. зарядний струм (А) 37,<br/>● Макс. вхідна потужність фотоелектричних модулів (Вт) 26000,<br/>● Діапазон напруги MPPT (B) 150–850,<br/>● Номінальна вхідна/вихідна потужність змінного струму (Вт) 20000,<br/>● Інтерфейс зв'язку CAN,<br/>● IP 65;r;2545,92;USD;шт.;;;;https://images.prom.ua/6705651991_invertor-deye-sun-20k-sg01hp3-eu-am2.jpg, https://images.prom.ua/6992263162_invertor-deye-sun-20k-sg01hp3-eu-am2.jpg;-;0;144038804;Инверторы;https://prom.ua/Invertory;;;;;2867075627;99-00024438;5140401;;Deye;;;;Vmin, V;https://oniks.org.ua/p2867075627-invertor-deye-sun.html;;;-;Ще краща  ціна за 📞;;;;;;;39.760;40.8;63.8;23.7;;Розмір упаковки (Ш х В х Г);;550 x 390 x 850 мм;Вага брутто;;39760;Строк гарантії;;60 міс.;Рабочая температура;;-40 - +60 С;Довжина;мм;237;Ширина;мм;408;Гарантійний термін;міс;60;Висота;мм;638;Вес;г;30500;Класс защиты;;IP65;Інтерфейс зв'язку;;CAN;Минимальная рабочая температура;град.;-40;Розміри, мм;;408×638×237;Максимальная рабочая температура;град.;60;Номинальная мощность;;20 000;Вихідна потужність, Вт;;20 000;Форма вихідної напруги;;Чиста синусоїда;Кількість фаз живлення;;3;Напруга батареї, В;;160-700;Струм зарядки батареї, А;;37;Номінальний струм;А;37;Напруга сонячних панелей, В;;150-850;Струм сонячних панелей, А;;26+26;Кількість MPPT(PWM)/стрінг на трекер;;2/2+2;Потужність сонячних панелей, Вт;;26 000;;;;;;;;;;;;;;;;;;;;;;;;;;;;;;;;;;;;;;;;;;;;;;;;;;;;;;;;;;;;;;;;;;;;;;;;;;;;;;;;;;;;;;;;;;;;;;;;;;;;;;;;;;;;;;;;;;;;;;;;;;;;;;;;;;;;;;;;;;;;;;;;;;;;;;;;;;;;;;;;;;;;;;;;;;;;;;;;;;;;;;;;;;;;;;;;;;;;;;;;;;;;;;;;;;;;;;;;;;;;;;;;;;;;;;;;;;;;;;;;;;;;;;;;;;;;;;;;;;;;;;;;;;;;;;;;;;;;;;;;;;;;;;;;;;;;;;;;;;;;;;;;;;;;;;;;;;;;;;;;;;;;;;;;;;;;;;;;;;;;;;;;;;;;;;;;;;;;;;;;;;;;;;;;;;;;;;;;;;;;;;;;;;;;;;;;;;;;;;;;;;;;;
200405;Turbo HD видеокамера Hikvision DS-2CE12DFT-F 2МП (3.6мм);Turbo HD відеокамера Hikvision DS-2CE12DFT-F 2МП (3.6мм);DS-2CE12DFT-F, Hikvision DS-2CE12DFT-F, Turbo HD Hikvision, Hikvision 3.6мм, камера 2mp, камера 4mp, камера 5mp, камера 8mp, tvi камера, ahd камера, камера 2.8 мм, камера с ик-подсветкой, купольная камера, цилиндрическая камера, ptz камера, камера для улицы, камера с записью, камера видеонаблюдения, уличная камера видеонаблюдения, камера безопасности, hd камера видеонаблюдения, камера видеонаблюдения с записью, камера наблюдения с датчиком движения, камера видеонаблюдения wifi, камеры видеонаблюдения для дома;DS-2CE12DFT-F, Hikvision DS-2CE12DFT-F, Turbo HD Hikvision, Hikvision 3.6мм, камера 2mp, камера 4mp, камера 5mp, камера 8mp, tvi камера, ahd камера, камера 2.8 мм, камера з ІЧ-підсвіткою, купольна камера, циліндрична камера, ptz камера, камера для вулиці, камера з записом, камера відеоспостереження, вулична камера відеоспостереження, камера безпеки, hd камера відеоспостереження, камера відеоспостереження з записом, камера спостереження з датчиком руху, камера відеоспостереження wifi, камери відеоспостереження для дому;● Разрешение 2МП 25к/с,<br/>● Фокус 3.6мм (угол обзора 83°),<br/>● Видимый свет (до 40м),<br/>● CVI/CVBS/AHD/TVI,<br/>● 12V DC,<br/>● IP67,<br/>● Цвет корпуса - белый;● Роздільна здатність 2МП 25к/с,<br/>● Фокус 3.6мм (кут огляду 83°),<br/>● Видимий світло (до 40м),<br/>● CVI/CVBS/AHD/TVI,<br/>● 12V DC,<br/>● IP67,<br/>● Колір корпусу – білий;r;51,24;USD;шт.;;;;https://images.prom.ua/1487319146_turbo-hd-videokamera.jpg;-;0;8950011;Видеокамеры для видеонаблюдения;https://prom.ua/Kamery-videonablyudeniya;;;;;2863455028;10000001420;301105;;Hikvision;;;;VMAX, V;https://oniks.org.ua/p2863455028-turbo-videokamera-hikvision.html;;;-;Ще краща  ціна за 📞;;;;;;;0.580;7.7;8.3;22.3;;Розмір упаковки (Ш х В х Г);;120 x 235 x 120 мм;Вага брутто;;580;Розміри;;223.1×77.1×82.6мм;Строк гарантії;;24 міс.;Рабочая температура;;-40 °C – +60 °C;Довжина;мм;223,1;Ширина;мм;77,1;Потужність споживання;;4.2 Вт;Гарантійний термін;міс;24;Вага;г;436;Висота;мм;82,6;Кількість в ящику;;32 шт;Максимальна робоча температура;град.;60;Живлення;;Мережа 12В;Мінімальна робоча температура;град.;-40;Степень защиты;;IP67;Кути огляду;;Г: 83°, В: 44°, Д: 98°;Тип подсветки;;видиме світло;Материал;;Металл/пластик;Захист обладнання від води і пилу IP;;IP67;Тип камери;;HD-TVI;Матриця;;2MP CMOS;Дальність підсвічування;;40м;Роздільна здатність (Мп);;2;Дальність ІЧ-підсвічування;м;40;WDR;;130 дБ;Фокусна відстань;мм;3,6;Тип матриці;;CMOS;Мін. чутливість;;0.0005 лк (F1.0, AGC Увімкнути), 0 лк з видимим світлом;Застосування;;Вулична;Придушення шуму (DNR);;3D;Кут огляду по горизонталі;град.;83;Апертура;;F1.0;Кут огляду по вертикалі;град.;44;BLC;;Так;Світлосила об'єктива;F;1;Регулювання по осях;;Поворот: 0 - 360 °, Нахил: 0 - 180 °, Обертання: 0 - 360 °;Швидкість затвора;;1/25 - 1/50 000 с;HLC;;Да;Антивандальний корпус;;Ні;Кут нахилу;град.;180;Рівень WDR;дБ;130;ROI;;4 зони;Наявність LED-підсвічування;;Так;Основні функції обробки;;4 зони маскування;Підтримка роздільної здатності;;1920 × 1080 25 к/с;;;;;;;;;;;;;;;;;;;;;;;;;;;;;;;;;;;;;;;;;;;;;;;;;;;;;;;;;;;;;;;;;;;;;;;;;;;;;;;;;;;;;;;;;;;;;;;;;;;;;;;;;;;;;;;;;;;;;;;;;;;;;;;;;;;;;;;;;;;;;;;;;;;;;;;;;;;;;;;;;;;;;;;;;;;;;;;;;;;;;;;;;;;;;;;;;;;;;;;;;;;;;;;;;;;;;;;;;;;;;;;;;;;;;;;;;;;;;;;;;;;;;;;;;;;;;;;;;;;;;;;;;;;;;;;;;;;;;;;;;;;;;;;;;;;;;;;;;;;;;;;;;;;;;;;;;;;;;;;;;;;;;;;;;;;;;;;;;;;;;;
200908;Вызывная панель Neolight Optima IPW (Black);Виклична панель Neolight Optima IPW (Black);ip видеодомофон, комплект видеодомофона, монитор видеодомофона, вызывная панель домофона, видеодомофон wifi, домофон 7 дюймов, домофон 10 дюймов, видеодомофон беспроводной, видеодомофон, видеодомофон с записью, домофон с экраном, видеодомофон для дома, домофон с камерой, комплект домофона;ip відеодомофон, комплект відеодомофона, монітор відеодомофона, викликова панель домофона, відеодомофон wifi, домофон 7 дюймів, домофон 10 дюймів, відеодомофон бездротовий, відеодомофон, відеодомофон з записом, домофон з екраном, відеодомофон для дому, домофон з камерою, комплект домофону;● Камера 2 Мп, 1920 х 1080 25 к/с Н.265,<br/>● Угол обзора    125°,<br/>● Тип подсветки ИК до 5 м,<br/>● Сетевой интерфейс Wi-Fi 2,4 ГГц, RJ-45, 10М/100М,<br/>● Встроенная память 32 ГБ,<br/>● Внешняя память microSD до 512ГБ,<br/>● Питание POE IEEE 802.3af / DC15-48V,<br/>● Температура эксплуатации - 30°С - + 60°С,<br/>● Класс защиты IP65;● Камера 2 Мп, 1920 х 1080 25 к/с Н.265,<br/>● Кут огляду    125°,<br/>● Тип підсвічування    ІЧ до 5 м,<br/>● Мережевий інтерфейс Wi-Fi 2,4ГГц, RJ-45, 10М/100М,<br/>● Вбудована пам'ять 32 ГБ,<br/>● Зовнішня пам'ять    microSD до 512ГБ,<br/>● Живлення    POE IEEE 802.3af / DC15-48V,<br/>● Температура експлуатації    - 30°С  ∼ + 60°С,<br/>● Клас захисту    IP65;r;110,71;USD;шт.;;;;https://images.prom.ua/6442010439_vyzyvnaya-panel-neolight.jpg, https://images.prom.ua/6992265415_vyzyvnaya-panel-neolight.jpg, https://images.prom.ua/6992265416_vyzyvnaya-panel-neolight.jpg, https://images.prom.ua/6992265417_vyzyvnaya-panel-neolight.jpg;-;0;90718784;Вызывные видеопанели;https://prom.ua/Domofony-videodomofony;;;;;2863455663;99-00023153;3029;;Neolight;;;;VMAX, V;https://oniks.org.ua/p2863455663-vyzyvnaya-panel-neolight.html;;;-;Ще краща  ціна за 📞;;;;;;;0.320;6.3;13.4;2.7;;Розмір упаковки (Ш х В х Г);;105 x 65 x 180 мм;Вага брутто;;320;Розміри;;63 х 134 х 27 мм;Рабочая температура;;- 30°С  - + 60°С;Довжина;мм;27;Ширина;мм;63;Вага;г;320;Висота;мм;134;Максимальна робоча температура;град.;60;Питание;;PoE;Степень защиты;;IP65;Кути огляду;;125°;Тип подсветки;;ІЧ до 5 м;Захист обладнання від води і пилу IP;;IP65;PoE;;802.3af;Тип пристрою;;Відеопанель кольорова виклична;Метод роботи;;кнопка;Ethernet;;RJ-45, 10М/100М;Wi-Fi;;802.11 b/g/n;Операционная система;;Linux;Камера;;CMOS;Протокол зв'язку;;RJ-45;Разрешение;;1920 х 1080 Н.265;Минимальная рабочая температура;град.;30;Кут огляду камери;град.;125;Керування замком;;замок/ворота, кнопка виходу, дверний дзвінок;Кількість абонентів;;1;Аудіо компресія;;G.711U;;;;;;;;;;;;;;;;;;;;;;;;;;;;;;;;;;;;;;;;;;;;;;;;;;;;;;;;;;;;;;;;;;;;;;;;;;;;;;;;;;;;;;;;;;;;;;;;;;;;;;;;;;;;;;;;;;;;;;;;;;;;;;;;;;;;;;;;;;;;;;;;;;;;;;;;;;;;;;;;;;;;;;;;;;;;;;;;;;;;;;;;;;;;;;;;;;;;;;;;;;;;;;;;;;;;;;;;;;;;;;;;;;;;;;;;;;;;;;;;;;;;;;;;;;;;;;;;;;;;;;;;;;;;;;;;;;;;;;;;;;;;;;;;;;;;;;;;;;;;;;;;;;;;;;;;;;;;;;;;;;;;;;;;;;;;;;;;;;;;;;;;;;;;;;;;;;;;;;;;;;;;;;;;;;;;;;;;;;;;;;;;;;;;;;;;;;;;
201806;Инвертор VictronEnergy MultiPlus-II 48/8000/110-100 однофазный чистая синусоида;Інвертор VictronEnergy MultiPlus-II 48/8000/110-100 однофазний чиста синусоїда;MultiPlus-II, инвертор 2000w, автомобильный инвертор, инвертор 3000w, солнечный инвертор, инвертор с зарядным устройством, инвертор 1000w, инвертор, преобразователь напряжения, инвертор 12 220, инвертор чистый синус;MultiPlus-II, інвертор 2000w, автомобільний інвертор, інвертор 3000w, сонячний інвертор, інвертор з зарядним пристроєм, інвертор 1000w, інвертор, перетворювач напруги, інвертор 12 220, інвертор чистий синус;● Максимальный вход переменного тока 100 А,<br/>● Диапазон входного напряжения постоянного тока 38–66 В,<br/>● Выход 230 В переменного тока,<br/>● Выходная мощность при 25°C 8000 ВА,<br/>● Вход переменного тока 187–265 В,<br/>● Вспомогательный выход 50 А,<br/>● Диапазон рабочих температур от -40 до +60°С,<br/>● 642 x 363 x 206 мм,<br/>● 42 кг;● Максимальний вхід змінного струму 100 А,<br/>● Діапазон вхідної напруги постійного струму 38–66 В,<br/>● Вихід 230 В змінного струму,<br/>● Вихідна потужність при 25°C 8000 ВА,<br/>● Вхід змінного струму 187–265 В,<br/>● Допоміжний вихід 50 А,<br/>● Діапазон робочих температур від -40 до +60 ° С,<br/>● 642 x 363 x 206 мм,<br/>● 42 кг;r;1834,24;USD;шт.;;;;https://images.prom.ua/6705653553_invertor-victronenergy-multiplus-ii.jpg, https://images.prom.ua/6992263342_invertor-victronenergy-multiplus-ii.jpg, https://images.prom.ua/6992263343_invertor-victronenergy-multiplus-ii.jpg, https://images.prom.ua/6992263344_invertor-victronenergy-multiplus-ii.jpg;+;4;144038804;Инверторы;https://prom.ua/Invertory;;;;;2863456735;99-00020913;5140401;;Victron Energy;;;;Vmin, V;https://oniks.org.ua/p2863456735-invertor-victronenergy-multiplus.html;;;-;Ще краща  ціна за 📞;;;;;;;45.520;64.2;36.3;20.6;;Вихідна потужність, Вт;;6 400;Напруга батареї, В;;38-66;Струм зарядки батареї, А;;110;Інтерфейс зв'язку;;VE.Bus;Клас захисту;;IP22;Робоча температура;;-40 - +65°С;Розміри, мм;;642 x 363 x 206 мм;Вага;г;42000;Розмір упаковки (Ш х В х Г);;450 x 300 x 740 мм;Вага брутто;;45520;Строк гарантії;;60 міс.;Номінальна потужність;Вт;6 400;Номінальний струм;А;110;Захист обладнання від води і пилу IP;;IP22;Мінімальна робоча температура навколишнього середовища;град.;-40;Максимальна робоча температура навколишнього середовища;град.;65;Ширина;мм;642;Висота;мм;363;Довжина;мм;206;Гарантійний термін;міс;60;Кількість фаз живлення;;1;Форма вихідної напруги;;Чиста синусоїда;;;;;;;;;;;;;;;;;;;;;;;;;;;;;;;;;;;;;;;;;;;;;;;;;;;;;;;;;;;;;;;;;;;;;;;;;;;;;;;;;;;;;;;;;;;;;;;;;;;;;;;;;;;;;;;;;;;;;;;;;;;;;;;;;;;;;;;;;;;;;;;;;;;;;;;;;;;;;;;;;;;;;;;;;;;;;;;;;;;;;;;;;;;;;;;;;;;;;;;;;;;;;;;;;;;;;;;;;;;;;;;;;;;;;;;;;;;;;;;;;;;;;;;;;;;;;;;;;;;;;;;;;;;;;;;;;;;;;;;;;;;;;;;;;;;;;;;;;;;;;;;;;;;;;;;;;;;;;;;;;;;;;;;;;;;;;;;;;;;;;;;;;;;;;;;;;;;;;;;;;;;;;;;;;;;;;;;;;;;;;;;;;;;;;;;;;;;;;;;;;;;;;;;;;;;;;;
201675;ИБП с правильной синусоидой под внешний АКБ RITAR RTSW-1500 LCD 1500VA 24В;ДБЖ з правильною синусоїдою під зовнішній АКБ RITAR RTSW-1500 LCD 1500VA 24В;RTSW-1500, ибп для компьютера, ибп онлайн, ибп для котла, ибп для видеонаблюдения, источник бесперебойного питания 12в, резервное питание, ибп 1000va, ибп, источник бесперебойного питания, ups, бесперебойник;RTSW-1500, дбж для комп'ютера, дбж онлайн, дбж для котла, дбж для відеоспостереження, джерело безперебійного живлення 12в, резервне живлення, дбж 1000va, джерело безперебійного живлення, дбж, ups, безперебійник;ИБП Ritar RTSW-1500 LCD с правильной синусоидой обеспечивает высокопроизводительную защиту компьютерных систем для бизнеса и офиса. Он обеспечивает батарейную поддержку, позволяющую продолжить работу при отключениях энергоснабжения средней и большой продолжительности.;ДБЖ Ritar RTSW-1500 LCD з правильною синусоїдою забезпечує високопродуктивний захист комп'ютерних систем для бізнесу та офісу. Він забезпечує батарейну підтримку, що дозволяє продовжити роботу при відключеннях енергопостачання середньої та великої тривалості.;r;189,4;USD;шт.;;;;https://images.prom.ua/6308592154_ibp-s-pravilnoj.jpg;-;0;127351948;ИБП, инверторы, стабилизаторы 220В;https://prom.ua/Istochnik-besperebojnogo-pitaniya-ibp;;;;;2868095184;99-00009709;14191106;;Ritar;;;;Vmin, V;https://oniks.org.ua/p2868095184-ibp-pravilnoj-sinusoidoj.html;;;-;Ще краща  ціна за 📞;;;;;;;14.460;;;;;Розмір упаковки (Ш х В х Г);;350 x 240 x 500 мм;Вага брутто;;14460;Строк гарантії;;12 міс.;Гарантійний термін;міс;12;Вес;г;14900;Входное напряжение;;145В-270В;Максимальна вхідна напруга;В;270;Мінімальна вхідна напруга;В;145;Сила струму на виході;;5А -10А;Вихідна потужність;Вт;1500;Номинальная мощность;;1500;Форма вихідної напруги;;Чиста синусоїда;Батарея;;24В (60-120A•г);Форма сигналу;;правильна синусоїда;;;;;;;;;;;;;;;;;;;;;;;;;;;;;;;;;;;;;;;;;;;;;;;;;;;;;;;;;;;;;;;;;;;;;;;;;;;;;;;;;;;;;;;;;;;;;;;;;;;;;;;;;;;;;;;;;;;;;;;;;;;;;;;;;;;;;;;;;;;;;;;;;;;;;;;;;;;;;;;;;;;;;;;;;;;;;;;;;;;;;;;;;;;;;;;;;;;;;;;;;;;;;;;;;;;;;;;;;;;;;;;;;;;;;;;;;;;;;;;;;;;;;;;;;;;;;;;;;;;;;;;;;;;;;;;;;;;;;;;;;;;;;;;;;;;;;;;;;;;;;;;;;;;;;;;;;;;;;;;;;;;;;;;;;;;;;;;;;;;;;;;;;;;;;;;;;;;;;;;;;;;;;;;;;;;;;;;;;;;;;;;;;;;;;;;;;;;;;;;;;;;;;;;;;;;;;;;;;;;;;;;;;;;;;;;;;;;;;;
